{
  "id": "sang-caustique",
  "nom": "Sang caustique",
  "url": "https://www.pathfinder-fr.org/Wiki/Pathfinder-RPG.Sang%20caustique.ashx",
  "ecole": "Transmutation",
  "descripteurs": [
    "acide"
  ],
  "niveaux": {
    "Alch": 4,
    "Con": 4,
    "ConU": 4,
    "Dru": 4,
    "Ens/Mag": 5,
    "Magus": 4,
    "Prê": 5,
    "San": 4
  },
  "temps_incantation": "1 action simple",
  "composantes": "V, G, M (une fiole de venin de vipère à tête noire)",
  "portee": "personnelle",
  "cible": "le lanceur de sorts",
  "duree": "1 round/niveau",
  "jet_de_sauvegarde": "Réflexes, 1/2 dégâts ou annule (voir texte)",
  "resistance_magie": "non",
  "description": "Le personnage imprègne son sang d'un acide corrosif. Chaque fois qu'il subit des dégâts perforants ou tranchants, une gerbe de sang acide jaillit de son corps en direction de l'adversaire qui l'a blessé, infligeant 1d6 points de dégâts d'acide par niveau de lanceur de sorts (maximum 15d6 ; Réflexes, 1/2 dégâts). Ce jet se déplace sur une ligne de 3 mètres, endommageant la première créature ou le premier objet qu'il touche, sans dégâts d'aspersion. Après avoir touché une créature ou un objet, le sang acide du personnage continue de brûler cette créature pendant 1 round, infligeant 1d6 points de dégâts d'acide par tranche de 2 niveaux de lanceur de sorts (maximum 7d6). Un second jet de Réflexes réussi annule ces dégâts supplémentaires.",
  "description_html": "<br/><br/>Le personnage imprègne son sang d'un acide corrosif. Chaque fois qu'il subit des dégâts perforants ou tranchants, une gerbe de sang acide jaillit de son corps en direction de l'adversaire qui l'a blessé, infligeant 1d6 points de dégâts d'acide par <a class=\"pagelink\" href=\"Pathfinder-RPG.NLS.ashx\" title=\"NLS\">niveau de lanceur de sorts</a> (maximum 15d6 ; <a class=\"pagelink\" href=\"Pathfinder-RPG.R%c3%a9flexes.ashx\" title=\"Réflexes\">Réflexes</a>, <a class=\"pagelink\" href=\"Pathfinder-RPG.Pr%c3%a9sentation%20des%20sorts.ashx#JETSDESAUVEGARDE\" title=\"Présentation des sorts\">1/2 dégâts</a>). Ce jet se déplace sur une ligne de 3 mètres, endommageant la première créature ou le premier objet qu'il touche, sans dégâts d'aspersion. Après avoir touché une créature ou un objet, le sang acide du personnage continue de brûler cette créature pendant 1 round, infligeant 1d6 points de dégâts d'acide par tranche de 2 niveaux de lanceur de sorts (maximum 7d6). Un second jet de Réflexes réussi annule ces dégâts supplémentaires.",
  "mythique": null,
  "variantes": [],
  "sources": [
    "Inner Sea Gods/Dieux de la mer Intérieure"
  ],
  "autres": {},
  "classes": [
    {
      "classe": "Alchimiste",
      "slug": "alchimiste",
      "niveau": 4,
      "niveau_page": 4,
      "concordance": true
    },
    {
      "classe": "Arcaniste/Ensorceleur/Magicien",
      "slug": "arcaniste-ensorceleur-magicien",
      "niveau": 5,
      "niveau_page": 5,
      "concordance": true
    },
    {
      "classe": "Chasseur",
      "slug": "chasseur",
      "niveau": 4,
      "niveau_page": null,
      "concordance": null
    },
    {
      "classe": "Conjurateur",
      "slug": "conjurateur",
      "niveau": 4,
      "niveau_page": 4,
      "concordance": true
    },
    {
      "classe": "Druide",
      "slug": "druide",
      "niveau": 4,
      "niveau_page": 4,
      "concordance": true
    },
    {
      "classe": "Magus",
      "slug": "magus",
      "niveau": 4,
      "niveau_page": 4,
      "concordance": true
    },
    {
      "classe": "Prêtre/Prêtre combattant/Oracle",
      "slug": "pretre-pretre-combattant-oracle",
      "niveau": 5,
      "niveau_page": 5,
      "concordance": true
    },
    {
      "classe": "Sanguin",
      "slug": "sanguin",
      "niveau": 4,
      "niveau_page": 4,
      "concordance": true
    }
  ],
  "meta": {
    "url": "https://www.pathfinder-fr.org/Wiki/Pathfinder-RPG.Sang%20caustique.ashx",
    "cache_fichier": "cache/html/2193f82fc16629fddf158ad3999affb076e77fea.html",
    "recupere_le": "2026-07-29T07:39:49.419273+00:00",
    "parser_version": "1.0.0"
  }
}
