{
  "id": "pieger-un-esprit",
  "nom": "Piéger un esprit",
  "url": "https://www.pathfinder-fr.org/Wiki/Pathfinder-RPG.Pi%c3%a9ger%20un%20esprit.ashx",
  "ecole": "Nécromancie",
  "descripteurs": [],
  "niveaux": {
    "Méd": 4,
    "Occ": 5,
    "Psy": 5,
    "Spi": 4
  },
  "temps_incantation": "1 action simple",
  "composantes": "V, G, F (petit miroir en argent)",
  "portee": "courte (7,50 m + 1,50 m/2 niveaux)",
  "cible": "créature intangible ou apparition",
  "duree": "1 heure/niveau (T)",
  "jet_de_sauvegarde": "Volonté, annule",
  "resistance_magie": "oui",
  "description": "Le personnage piège la cible dans le miroir qui lui sert de focalisateur. Une fois dans le miroir, plus rien ne peut affecter cette cible.\nSi le miroir est détruit, toute créature intangible piégée dedans est soudain libérée et toute apparition retourne à son emplacement initial. Une créature qui adopte une forme intangible via un sort ou autre reste ainsi tant qu’elle est prisonnière du miroir, même si la durée de l’effet la rendant intangible arrive à son terme. Si le miroir servant de focalisateur appartenait à la cible, cette dernière subit un malus de –2 au jet de sauvegarde.",
  "description_html": "<br/><br/>Le personnage piège la cible dans le miroir qui lui sert de focalisateur. Une fois dans le miroir, plus rien ne peut affecter cette cible.<br/><br/>Si le miroir est détruit, toute créature intangible piégée dedans est soudain libérée et toute apparition retourne à son emplacement initial. Une créature qui adopte une forme intangible via un sort ou autre reste ainsi tant qu’elle est prisonnière du miroir, même si la durée de l’effet la rendant intangible arrive à son terme. Si le miroir servant de focalisateur appartenait à la cible, cette dernière subit un malus de –2 au jet de sauvegarde.",
  "mythique": null,
  "variantes": [],
  "sources": [
    "Occult Adventures/Aventures occultes"
  ],
  "autres": {},
  "classes": [],
  "meta": {
    "url": "https://www.pathfinder-fr.org/Wiki/Pathfinder-RPG.Pi%c3%a9ger%20un%20esprit.ashx",
    "cache_fichier": "cache/html/31719950a699ff4ef28e42f8b6b3d6cd276910ff.html",
    "recupere_le": "2026-07-28T23:03:23.955398+00:00",
    "parser_version": "1.0.0"
  }
}
