{
  "id": "tempete-vengeresse",
  "nom": "Tempête vengeresse",
  "url": "https://www.pathfinder-fr.org/Wiki/Pathfinder-RPG.Temp%c3%aate%20vengeresse.ashx",
  "ecole": "Invocation (convocation)",
  "descripteurs": [],
  "niveaux": {
    "Cham": 9,
    "Dru": 9,
    "Prê": 9,
    "Sor": 9
  },
  "temps_incantation": "1 round",
  "composantes": "V, G",
  "portee": "longue (120 m + 12 m/niveau) (80 c + 8 c/niveau)",
  "cible": "nuage de 108 m de rayon",
  "duree": "concentration (jusqu’à 10 rounds) (T)",
  "jet_de_sauvegarde": "voir description",
  "resistance_magie": "oui",
  "description": "Ce sort fait apparaître un énorme nuage noir, qui lance des éclairs et des coups de tonnerre. Toutes les créatures qui se trouvent en dessous doivent réussir un jet de Vigueur sous peine d’être assourdies pendant 1d4x10 minutes. Si le lanceur de sorts cesse de se concentrer, le sort s’achève immédiatement, sinon, il produit des effets différents au cours des rounds suivants, comme détaillé ci-dessous. Chaque effet se manifeste durant le tour de jeu du personnage.\nDeuxième round : une pluie acide s’abat sur la zone d’effet et inflige 1d6 points de dégâts d’acide (pas de jet de sauvegarde).\nTroisième round : le prêtre appelle six éclairs et décide où ils tomberont (une même cible ne peut être touchée que par un seul éclair). Chaque éclair inflige 10d6 points de dégâts d’électricité, un jet de Réflexes réussi réduit les dégâts de moitié.\nQuatrième round : une pluie de grêlons s’abat sur la zone d’effet et inflige 5d6 points de dégâts contondants (pas de jet de sauvegarde).\nDu cinquième au dixième round : Une pluie et des vents violents réduisent la visibilité (vision dans le noir comprise) à 1,50 mètre. Tout adversaire qui se trouve à 1,50 m ou moins bénéficie d’un camouflage (ce qui signifie que les attaques ont 20 % de chances de le rater). Plus loin, il bénéficie d’un camouflage total (50 % de chances que l’attaque échoue et l’assaillant ne peut localiser sa cible à l’œil nu). La vitesse de déplacement passe à 25 % de sa valeur habituelle.\nIl est impossible d’attaquer à distance. Enfin, tout lanceur de sorts qui désire faire appel à sa magie doit réussir un test de concentration contre un DD égal à celui de tempête vengeresse + le niveau du sort que le personnage essaye de jeter (en cas d’échec, le sort est perdu).",
  "description_html": "<br/><br/>Ce sort fait apparaître un énorme nuage noir, qui lance des éclairs et des coups de tonnerre. Toutes les créatures qui se trouvent en dessous doivent réussir un jet de <a class=\"pagelink\" href=\"Pathfinder-RPG.Vigueur.ashx\" title=\"Vigueur\">Vigueur</a> sous peine d’être <a class=\"pagelink\" href=\"Pathfinder-RPG.assourdi.ashx\" title=\"Assourdi\">assourdies</a> pendant 1d4x10 minutes. Si le lanceur de sorts cesse de se <a class=\"pagelink\" href=\"Pathfinder-RPG.concentration.ashx\" title=\"Concentration\">concentrer</a>, le sort s’achève immédiatement, sinon, il produit des effets différents au cours des <a class=\"pagelink\" href=\"Pathfinder-RPG.round.ashx\" title=\"round\">rounds</a> suivants, comme détaillé ci-dessous. Chaque effet se manifeste durant le tour de jeu du personnage.<br/><br/>Deuxième round : une pluie acide s’abat sur la <a class=\"pagelink\" href=\"Pathfinder-RPG.zone%20deffet.ashx\" title=\"zone deffet\">zone d’effet</a> et inflige 1d6 points de dégâts d’acide (pas de <a class=\"pagelink\" href=\"Pathfinder-RPG.jet%20de%20sauvegarde.ashx\" title=\"jet de sauvegarde\">jet de sauvegarde</a>).<br/><br/>Troisième round : le prêtre appelle six éclairs et décide où ils tomberont (une même cible ne peut être touchée que par un seul éclair). Chaque éclair inflige 10d6 points de dégâts d’électricité, un jet de <a class=\"pagelink\" href=\"Pathfinder-RPG.R%c3%a9flexes.ashx\" title=\"Réflexes\">Réflexes</a> réussi réduit les dégâts de moitié.<br/><br/>Quatrième round : une pluie de grêlons s’abat sur la <a class=\"pagelink\" href=\"Pathfinder-RPG.zone%20deffet.ashx\" title=\"zone deffet\">zone d’effet</a> et inflige 5d6 points de dégâts contondants (pas de <a class=\"pagelink\" href=\"Pathfinder-RPG.jet%20de%20sauvegarde.ashx\" title=\"jet de sauvegarde\">jet de sauvegarde</a>).<br/><br/>Du cinquième au dixième <a class=\"pagelink\" href=\"Pathfinder-RPG.round.ashx\" title=\"round\">round</a> : Une pluie et des vents violents réduisent la visibilité (<a class=\"pagelink\" href=\"Pathfinder-RPG.vision%20dans%20le%20noir.ashx\" title=\"vision dans le noir\">vision dans le noir</a> comprise) à 1,50 mètre. Tout adversaire qui se trouve à 1,50 m ou moins bénéficie d’un <a class=\"pagelink\" href=\"Pathfinder-RPG.camouflage.ashx\" title=\"camouflage\">camouflage</a> (ce qui signifie que les attaques ont 20 % de chances de le rater). Plus loin, il bénéficie d’un <a class=\"pagelink\" href=\"Pathfinder-RPG.camouflage.ashx\" title=\"camouflage\">camouflage total</a> (50 % de chances que l’attaque échoue et l’assaillant ne peut localiser sa cible à l’œil nu). La <a class=\"pagelink\" href=\"Pathfinder-RPG.vitesse%20de%20d%c3%a9placement.ashx\" title=\"vitesse de déplacement\">vitesse de déplacement</a> passe à 25 % de sa valeur habituelle.<br/><br/>Il est impossible d’attaquer à distance. Enfin, tout lanceur de sorts qui désire faire appel à sa magie doit réussir un test de <a class=\"pagelink\" href=\"Pathfinder-RPG.concentration.ashx\" title=\"Concentration\">concentration</a> contre un <a class=\"pagelink\" href=\"Pathfinder-RPG.DD.ashx\" title=\"DD\">DD</a> égal à celui de <i>tempête vengeresse</i> + le <a class=\"pagelink\" href=\"Pathfinder-RPG.niveau%20du%20sort.ashx\" title=\"niveau du sort\">niveau du sort</a> que le personnage essaye de jeter (en cas d’échec, le sort est perdu).<br/><br/>",
  "mythique": {
    "description": "Les dégâts infligés par la pluie acide s’élèvent à 1d8 points de dégâts d’acide. Les dégâts infligés par les éclairs s’élèvent à 10d8 points de dégâts d’électricité. Le personnage peut appeler un éclair lors des deuxième et quatrième rounds (équivalent à ceux du troisième round). Il peut frapper la même cible plus d’une fois avec un éclair pendant la durée du sort, mais pas plus d’une fois par round.\nAmplifié (7ème). Si le personnage dépense trois utilisations de pouvoir mythique, le rayon du nuage s’élève à 300 mètres. Les bâtiments dans la zone d’effet subissent 1d10 points de dégâts par round (ces dégâts ignorent la solidité). Le personnage peut appeler un éclair supplémentaire lors des deuxième et quatrième rounds et trois éclairs supplémentaires lors du troisième round.",
    "description_html": "Les dégâts infligés par la pluie acide s’élèvent à 1d8 points de dégâts d’acide. Les dégâts infligés par les éclairs s’élèvent à 10d8 points de dégâts d’électricité. Le personnage peut appeler un éclair lors des deuxième et quatrième rounds (équivalent à ceux du troisième round). Il peut frapper la même cible plus d’une fois avec un éclair pendant la durée du sort, mais pas plus d’une fois par round.<br/><br/><b><a class=\"pagelink\" href=\"Pathfinder-RPG.Amplifi%c3%a9.ashx\" title=\"Amplifié\">Amplifié</a> (7ème).</b> Si le personnage dépense trois utilisations de <a class=\"pagelink\" href=\"Pathfinder-RPG.pouvoir%20mythique.ashx\" title=\"pouvoir mythique\">pouvoir mythique</a>, le rayon du nuage s’élève à 300 mètres. Les bâtiments dans la zone d’effet subissent 1d10 points de dégâts par round (ces dégâts ignorent la solidité). Le personnage peut appeler un éclair supplémentaire lors des deuxième et quatrième rounds et trois éclairs supplémentaires lors du troisième round."
  },
  "variantes": [],
  "sources": [
    "Mythic Adventures, Mythic Origins/Campagnes mythiques"
  ],
  "autres": {},
  "classes": [],
  "meta": {
    "url": "https://www.pathfinder-fr.org/Wiki/Pathfinder-RPG.Temp%c3%aate%20vengeresse.ashx",
    "cache_fichier": "cache/html/9b8d5c1287e3111b982f84543fa4d56c3ae47b86.html",
    "recupere_le": "2026-07-29T07:42:22.714852+00:00",
    "parser_version": "1.0.0"
  }
}
