{
  "id": "benediction-karmique",
  "nom": "Bénédiction karmique",
  "url": "https://www.pathfinder-fr.org/Wiki/Pathfinder-RPG.B%c3%a9n%c3%a9diction%20karmique.ashx",
  "ecole": "Divination",
  "descripteurs": [
    "Bien"
  ],
  "niveaux": {
    "Prê": 1,
    "Sor": 1
  },
  "temps_incantation": "1 action simple",
  "composantes": "V, G",
  "portee": "contact",
  "cible": "une créature touchée",
  "duree": "1 heure/niveau",
  "jet_de_sauvegarde": "Volonté, annule",
  "resistance_magie": "oui (inoffensif)",
  "description": "La cible traite l’une des compétences de son choix comme une compétence de classe.",
  "description_html": "<br/><br/>La cible traite l’une des <a class=\"pagelink\" href=\"Pathfinder-RPG.Comp%c3%a9tences.ashx\" title=\"Les compétences\">compétences</a> de son choix comme une compétence de classe.",
  "mythique": null,
  "variantes": [],
  "sources": [
    "Advanced Race Guide, Elves of Golarion, Gnomes of Golarion, Goblins of Golarion, Halflings of Golarion, Humans of Golarion, Dwarves of Golarion, Orcs of Golarion/Manuel des races"
  ],
  "autres": {
    "restriction_divinite": "Option plus\ncommune chez\nles samsarans."
  },
  "classes": [],
  "meta": {
    "url": "https://www.pathfinder-fr.org/Wiki/Pathfinder-RPG.B%c3%a9n%c3%a9diction%20karmique.ashx",
    "cache_fichier": "cache/html/4355928bbbf952844c38cd5ac69535b075140a42.html",
    "recupere_le": "2026-07-28T22:43:09.244406+00:00",
    "parser_version": "1.0.0"
  }
}
