{
  "id": "perception-des-proches",
  "nom": "Perception des proches",
  "url": "https://www.pathfinder-fr.org/Wiki/Pathfinder-RPG.Perception%20des%20proches.ashx",
  "ecole": "Divination",
  "descripteurs": [
    "effet mental"
  ],
  "niveaux": {
    "Bard": 1,
    "Cham": 1,
    "Hyp": 1,
    "Ens/Mag": 1,
    "Méd": 1,
    "Occ": 1,
    "Psy": 1,
    "Sor": 1,
    "Spi": 1
  },
  "temps_incantation": "1 action simple",
  "composantes": "V, G, F (une pièce de cuivre)",
  "portee": "18 m",
  "cible": "une créature",
  "duree": "concentration, au maximum 1 minute/niveau (T)",
  "jet_de_sauvegarde": "Volonté, annule (voir texte)",
  "resistance_magie": "oui",
  "description": "Le personnage peut examiner les pensées d’un individu et apprendre le nom et la position des proches parents vivants de la cible, ainsi que l’attitude de la cible à l’égard de ces parents (et inversement). Il obtient des informations sur un parent par round où il se concentre sur la cible. Par exemple, il pourrait apprendre que le père de la cible s’appelle Jarn, qu’il vit dans une ferme du coin et que son enfant et lui ne s’entendent pas très bien. Étant donné que ce sort permet de lire l’esprit de la cible, le personnage ne peut apprendre que ce que la cible sait ou croit savoir.",
  "description_html": "<br/><br/>Le personnage peut examiner les pensées d’un individu et apprendre le nom et la position des proches parents vivants de la cible, ainsi que l’attitude de la cible à l’égard de ces parents (et inversement). Il obtient des informations sur un parent par round où il se concentre sur la cible. Par exemple, il pourrait apprendre que le père de la cible s’appelle Jarn, qu’il vit dans une ferme du coin et que son enfant et lui ne s’entendent pas très bien. Étant donné que ce sort permet de lire l’esprit de la cible, le personnage ne peut apprendre que ce que la cible sait ou croit savoir.",
  "mythique": null,
  "variantes": [],
  "sources": [
    "Advanced Class Guide/Manuel des joueurs - Classes avancées"
  ],
  "autres": {},
  "classes": [
    {
      "classe": "Arcaniste/Ensorceleur/Magicien",
      "slug": "arcaniste-ensorceleur-magicien",
      "niveau": 1,
      "niveau_page": 1,
      "concordance": true
    },
    {
      "classe": "Barde",
      "slug": "barde",
      "niveau": 1,
      "niveau_page": 1,
      "concordance": true
    },
    {
      "classe": "Chaman",
      "slug": "chaman",
      "niveau": 1,
      "niveau_page": 1,
      "concordance": true
    },
    {
      "classe": "Hypnotiseur",
      "slug": "hypnotiseur",
      "niveau": 1,
      "niveau_page": 1,
      "concordance": true
    },
    {
      "classe": "Médium",
      "slug": "medium",
      "niveau": 1,
      "niveau_page": 1,
      "concordance": true
    },
    {
      "classe": "Occultiste",
      "slug": "occultiste",
      "niveau": 1,
      "niveau_page": 1,
      "concordance": true
    },
    {
      "classe": "Psychiste",
      "slug": "psychiste",
      "niveau": 1,
      "niveau_page": 1,
      "concordance": true
    },
    {
      "classe": "Sorcière",
      "slug": "sorciere",
      "niveau": 1,
      "niveau_page": 1,
      "concordance": true
    },
    {
      "classe": "Spirite",
      "slug": "spirite",
      "niveau": 1,
      "niveau_page": 1,
      "concordance": true
    }
  ],
  "meta": {
    "url": "https://www.pathfinder-fr.org/Wiki/Pathfinder-RPG.Perception%20des%20proches.ashx",
    "cache_fichier": "cache/html/5e9eeb362b9b7ca9641d6cdc16270fab441e7e0d.html",
    "recupere_le": "2026-07-28T23:03:02.941999+00:00",
    "parser_version": "1.0.0"
  }
}
