{
  "id": "hurlement-primitif",
  "nom": "Hurlement primitif",
  "url": "https://www.pathfinder-fr.org/Wiki/Pathfinder-RPG.Hurlement%20primitif.ashx",
  "ecole": "Abjuration",
  "descripteurs": [
    "mental",
    "son"
  ],
  "niveaux": {
    "Bard": 4,
    "Hyp": 4
  },
  "temps_incantation": "1 action simple",
  "composantes": "V",
  "portee": "personnelle",
  "cible": "lanceur de sorts",
  "duree": "1 round/niveau",
  "jet_de_sauvegarde": null,
  "resistance_magie": null,
  "description": "Le personnage pousse un puissant cri issu des profondeurs de son âme. Ce cri le revigore et dissipe les effets d'enchantement et de paralysie. Ce sort fonctionne comme annulation d'enchantement mais il affecte uniquement le personnage et le libère seulement des effets d'enchantement et de paralysie. Si le personnage réussie son test ne niveau de lanceur de sorts pour briser l'effet hostile, il parvient à pousser un hurlement et le sort fait effet, sinon, le sort échoue sans le moindre effet. Le personnage peut lancer ce sort même si il est paralysé ou incapable de parler à cause d'un effet d'enchantement mais pas dans une zone de silence, s'il ne peut pa parler pour des raisons autres qu'un effet de paralysie ou d'enchantement(s'il est bâillonné par exemple), ou dans un environnement où il est impossible de s'exprimer.",
  "description_html": "<br/><br/>Le personnage pousse un puissant cri issu des profondeurs de son âme. Ce cri le revigore et dissipe les effets d'enchantement et de paralysie. Ce sort fonctionne comme <i><a class=\"pagelink\" href=\"Pathfinder-RPG.Annulation%20denchantement.ashx\" title=\"Annulation d'enchantement\">annulation d'enchantement</a></i> mais il affecte uniquement le personnage et le libère seulement des effets d'enchantement et de paralysie. Si le personnage réussie son <a class=\"pagelink\" href=\"Pathfinder-RPG.test.ashx\" title=\"test\">test</a> ne <a class=\"pagelink\" href=\"Pathfinder-RPG.niveau.ashx\" title=\"niveau\">niveau</a> de lanceur de sorts pour briser l'effet hostile, il parvient à pousser un hurlement et le sort fait effet, sinon, le sort échoue sans le moindre effet. Le personnage peut lancer ce sort même si il est <a class=\"pagelink\" href=\"Pathfinder-RPG.paralys%c3%a9.ashx\" title=\"Paralysé\">paralysé</a> ou incapable de parler à cause d'un effet d'enchantement mais pas dans une zone de silence, s'il ne peut pa parler pour des raisons autres qu'un effet de <a class=\"pagelink\" href=\"Pathfinder-RPG.paralys%c3%a9.ashx\" title=\"Paralysé\">paralysie</a> ou d'enchantement(s'il est bâillonné par exemple), ou dans un environnement où il est impossible de s'exprimer.",
  "mythique": null,
  "variantes": [],
  "sources": [
    "Ultimate Magic/Art de la Magie"
  ],
  "autres": {},
  "classes": [],
  "meta": {
    "url": "https://www.pathfinder-fr.org/Wiki/Pathfinder-RPG.Hurlement%20primitif.ashx",
    "cache_fichier": "cache/html/1109ecc9c0136a6a72c48a73fe73c36709386d84.html",
    "recupere_le": "2026-07-28T22:56:20.485378+00:00",
    "parser_version": "1.0.0"
  }
}
