{
  "id": "zone-d-antimagie",
  "nom": "Zone d'antimagie",
  "url": "https://www.pathfinder-fr.org/Wiki/Pathfinder-RPG.Zone%20dantimagie.ashx",
  "ecole": "Abjuration",
  "descripteurs": [],
  "niveaux": {
    "Ens/Mag": 6,
    "Occ": 6,
    "Prê": 8,
    "Psy": 7
  },
  "temps_incantation": "1 action simple",
  "composantes": "V, G, M/FD (une pincée de poudre de fer ou quelques copeaux du même métal)",
  "portee": "3 m (2 c)",
  "cible": "émanation de 3 m (2 c) de rayon centrée sur le jeteur de sorts",
  "duree": "10 minutes/niveau (T)",
  "jet_de_sauvegarde": "aucun",
  "resistance_magie": "voir description",
  "description": "Ce sort d’abjuration génère une barrière invisible se déplaçant avec le lanceur de sorts. Tout ce qui se trouve dans cette sphère est immunisé contre la plupart des effets magiques (sorts, pouvoirs magiques et pouvoirs surnaturels). De même, aucun sort ni objet magique ne peut fonctionner à l’intérieur.\nUne zone d’antimagie annule (sans le dissiper) tout sort ou effet magique lancé à l’intérieur ou amené dans la zone d’effet. Le temps passé à l’intérieur de la zone d’antimagie est décompté normalement pour ce qui est de la durée du sort dont les effets sont annulés.\nLes créatures convoquées de n'importe quel type disparaissent dès qu’elles pénètrent dans une zone d’antimagie puis réapparaissent au même endroit dès que la sphère s’est déplacée. Elles cessent en fait d’exister pendant une durée qui est décomptée normalement de leur durée d’invocation. Si on lance zone d’antimagie dans un lieu occupé par une créature convoquée bénéficiant d’une résistance à la magie, il faut réussir un jet de niveau de lanceur de sorts (1d20 + niveau de jeteur de sorts) pour la faire disparaître (le DD est égal à la résistance à la magie du monstre). L’effet des invocations instantanées n’est pas modifié par une zone d’antimagie car la magie qui a permis l’apparition de ce qui est invoqué a depuis longtemps disparu.\nLes créatures normales peuvent entrer dans la zone d’antimagie, tout comme les projectiles non-magiques. De plus, si une épée magique perd temporairement son bonus et ses pouvoirs au contact du sort, elle reste une épée de maître. La zone d’antimagie n’a pas d’effet sur les golems et les autres créatures artificielles élaborées par magie mais capables par la suite de fonctionner sans aide extérieure (à moins qu’elles aient été convoquées, comme indiqué plus haut). Cette règle s’applique également aux élémentaires, aux morts-vivants et aux Extérieurs. Les pouvoirs magiques ou surnaturels de toutes ces créatures sont toutefois réprimés par le sort. Dissipation de la magie ne peut rien contre cette abjuration.\nSi une créature est plus grande que la zone d’effet, les parties de son corps sortant de la sphère ne sont pas protégées.",
  "description_html": "<br/><br/>Ce sort d’<a class=\"pagelink\" href=\"Pathfinder-RPG.abjuration.ashx\" title=\"Abjuration\">abjuration</a> génère une barrière invisible se déplaçant avec le lanceur de sorts. Tout ce qui se trouve dans cette sphère est immunisé contre la plupart des effets magiques (sorts, <a class=\"pagelink\" href=\"Pathfinder-RPG.Capacit%c3%a9s%20sp%c3%a9ciales.ashx#TYPES\" title=\"Les capacités spéciales\">pouvoirs magiques</a> et <a class=\"pagelink\" href=\"Pathfinder-RPG.Capacit%c3%a9s%20sp%c3%a9ciales.ashx#TYPES\" title=\"Les capacités spéciales\">pouvoirs surnaturels</a>). De même, aucun sort ni objet magique ne peut fonctionner à l’intérieur.<br/><br/>Une <i>zone d’antimagie</i> annule (sans le dissiper) tout sort ou effet magique lancé à l’intérieur ou amené dans la <a class=\"pagelink\" href=\"Pathfinder-RPG.zone%20deffet.ashx\" title=\"zone deffet\">zone d’effet</a>. Le temps passé à l’intérieur de la <i>zone d’antimagie</i> est décompté normalement pour ce qui est de la durée du sort dont les effets sont annulés.<br/><br/>Les créatures convoquées de n'importe quel type disparaissent dès qu’elles pénètrent dans une <i>zone d’antimagie</i> puis réapparaissent au même endroit dès que la sphère s’est déplacée. Elles cessent en fait d’exister pendant une durée qui est décomptée normalement de leur durée d’invocation. Si on lance <i>zone d’antimagie</i> dans un lieu occupé par une créature convoquée bénéficiant d’une <a class=\"pagelink\" href=\"Pathfinder-RPG.RM.ashx\" title=\"RM\">résistance à la magie</a>, il faut réussir un jet de <a class=\"pagelink\" href=\"Pathfinder-RPG.NLS.ashx\" title=\"NLS\">niveau de lanceur de sorts</a> (1d20 + <a class=\"pagelink\" href=\"Pathfinder-RPG.NLS.ashx\" title=\"NLS\">niveau de jeteur de sorts</a>) pour la faire disparaître (le <a class=\"pagelink\" href=\"Pathfinder-RPG.DD.ashx\" title=\"DD\">DD</a> est égal à la <a class=\"pagelink\" href=\"Pathfinder-RPG.RM.ashx\" title=\"RM\">résistance à la magie</a> du monstre). L’effet des invocations instantanées n’est pas modifié par une <i>zone d’antimagie</i> car la magie qui a permis l’apparition de ce qui est invoqué a depuis longtemps disparu.<br/><br/>Les créatures normales peuvent entrer dans la <i>zone d’antimagie</i>, tout comme les projectiles non-magiques. De plus, si une épée magique perd temporairement son bonus et ses pouvoirs au contact du sort, elle reste une épée <a class=\"pagelink\" href=\"Pathfinder-RPG.arme%20de%20ma%c3%aetre.ashx\" title=\"arme de maître\">de maître</a>. La <i>zone d’antimagie</i> n’a pas d’effet sur les golems et les autres <a class=\"pagelink\" href=\"Pathfinder-RPG.type%20Cr%c3%a9ature%20artificielle.ashx\" title=\"Créature artificielle\">créatures artificielles</a> élaborées par magie mais capables par la suite de fonctionner sans aide extérieure (à moins qu’elles aient été convoquées, comme indiqué plus haut). Cette règle s’applique également aux <a class=\"pagelink\" href=\"Pathfinder-RPG.sous-type%20%c3%a9l%c3%a9mentaire.ashx\" title=\"Élémentaire (sous-type)\">élémentaires</a>, aux <a class=\"pagelink\" href=\"Pathfinder-RPG.type%20Mort-vivant.ashx\" title=\"Mort-vivant\">morts-vivants</a> et aux <a class=\"pagelink\" href=\"Pathfinder-RPG.type%20Ext%c3%a9rieur.ashx\" title=\"Extérieur\">Extérieurs</a>. Les pouvoirs magiques ou surnaturels de toutes ces créatures sont toutefois réprimés par le sort. <i><a class=\"pagelink\" href=\"Pathfinder-RPG.Dissipation%20de%20la%20magie.ashx\" title=\"Dissipation de la magie\">Dissipation de la magie</a></i> ne peut rien contre cette abjuration.<br/><br/>Si une créature est plus grande que la <a class=\"pagelink\" href=\"Pathfinder-RPG.zone%20deffet.ashx\" title=\"zone deffet\">zone d’effet</a>, les parties de son corps sortant de la sphère ne sont pas protégées.<br/><br/>",
  "mythique": {
    "description": "Choisissez un nombre d’écoles de magie égal au grade du personnage. Les sorts et les effets issus des écoles choisies ne sont pas affectés par la zone d’antimagie.",
    "description_html": "Choisissez un nombre d’écoles de magie égal au <a class=\"pagelink\" href=\"Pathfinder-RPG.grade.ashx\" title=\"Grade\">grade</a> du personnage. Les sorts et les effets issus des écoles choisies ne sont pas affectés par la zone d’antimagie."
  },
  "variantes": [],
  "sources": [
    "Mythic Adventures, Mythic Origins/Campagnes mythiques"
  ],
  "autres": {},
  "classes": [
    {
      "classe": "Arcaniste/Ensorceleur/Magicien",
      "slug": "arcaniste-ensorceleur-magicien",
      "niveau": 6,
      "niveau_page": 6,
      "concordance": true
    },
    {
      "classe": "Occultiste",
      "slug": "occultiste",
      "niveau": 6,
      "niveau_page": 6,
      "concordance": true
    },
    {
      "classe": "Prêtre/Prêtre combattant/Oracle",
      "slug": "pretre-pretre-combattant-oracle",
      "niveau": 8,
      "niveau_page": 8,
      "concordance": true
    },
    {
      "classe": "Psychiste",
      "slug": "psychiste",
      "niveau": 7,
      "niveau_page": 7,
      "concordance": true
    }
  ],
  "meta": {
    "url": "https://www.pathfinder-fr.org/Wiki/Pathfinder-RPG.Zone%20dantimagie.ashx",
    "cache_fichier": "cache/html/7b8ad53101e9a208dcd8643c371684db1ec7fa42.html",
    "recupere_le": "2026-07-29T07:44:53.462622+00:00",
    "parser_version": "1.0.0"
  }
}
