{
  "id": "silence",
  "nom": "Silence",
  "url": "https://www.pathfinder-fr.org/Wiki/Pathfinder-RPG.Silence.ashx",
  "ecole": "Illusion (hallucination)",
  "descripteurs": [],
  "niveaux": {
    "Apal": 2,
    "Bard": 2,
    "Hyp": 2,
    "Inq": 2,
    "Prê": 2,
    "Psy": 2
  },
  "temps_incantation": "1 round",
  "composantes": "V, G",
  "portee": "longue (120 m + 12 m/niveau) (80 c + 8 c/niveau)",
  "cible": "émanation de 6 m (4 c) de rayon, centrée sur une créature, un objet ou un point donné",
  "duree": "1 round/niveau (T)",
  "jet_de_sauvegarde": "Volonté, annule (voir description) ou aucun (objet)",
  "resistance_magie": "oui (voir description) ou non (objet)",
  "description": "À la fin de l’incantation, un silence absolu s’abat sur la zone choisie par le personnage. Tous les sons cessent d’exister : les conversations s’arrêtent, il est impossible de jeter le moindre sort à composante verbale et nul bruit n’entre ni ne sort de la zone. Un personnage peut lancer silence n’importe où (pas besoin de prendre un objet pour cible), mais sa zone d’effet reste stationnaire, à moins d’être jeté sur une créature (auquel cas, la zone d’effet se déplace avec). Un individu qui ne veut pas être pris pour cible par le sort peut y échapper en réussissant un jet de Volonté (et, le cas échéant, grâce à sa résistance à la magie). Les objets détenus par une créature ont eux aussi droit à un jet de sauvegarde (et à un éventuel test de résistance à la magie), de même que les objets magiques qui émettent des bruits mais ce n’est pas le cas des objets qui n’appartiennent à personne ou des points qui ne correspondent à rien de solide. Les créatures qui se trouvent dans la zone du silence sont immunisées contre les attaques, les sorts et les effets du registre du son ou basés sur le langage.",
  "description_html": "<br/><br/>À la fin de l’incantation, un silence absolu s’abat sur la zone choisie par le personnage. Tous les sons cessent d’exister : les conversations s’arrêtent, il est impossible de jeter le moindre sort à <a class=\"pagelink\" href=\"Pathfinder-RPG.composante%20verbale.ashx\" title=\"composante verbale\">composante verbale</a> et nul bruit n’entre ni ne sort de la zone. Un personnage peut lancer <i>silence</i> n’importe où (pas besoin de prendre un objet pour cible), mais sa <a class=\"pagelink\" href=\"Pathfinder-RPG.zone%20deffet.ashx\" title=\"zone deffet\">zone d’effet</a> reste stationnaire, à moins d’être jeté sur une créature (auquel cas, la zone d’effet se déplace avec). Un individu qui ne veut pas être pris pour <a class=\"pagelink\" href=\"Pathfinder-RPG.cible.ashx\" title=\"cible\">cible</a> par le sort peut y échapper en réussissant un jet de <a class=\"pagelink\" href=\"Pathfinder-RPG.Volont%c3%a9.ashx\" title=\"Volonté\">Volonté</a> (et, le cas échéant, grâce à sa <a class=\"pagelink\" href=\"Pathfinder-RPG.RM.ashx\" title=\"RM\">résistance à la magie</a>). Les objets détenus par une créature ont eux aussi droit à un <a class=\"pagelink\" href=\"Pathfinder-RPG.jet%20de%20sauvegarde.ashx\" title=\"jet de sauvegarde\">jet de sauvegarde</a> (et à un éventuel test de résistance à la magie), de même que les objets magiques qui émettent des bruits mais ce n’est pas le cas des objets qui n’appartiennent à personne ou des points qui ne correspondent à rien de solide. Les créatures qui se trouvent dans la zone du silence sont immunisées contre les attaques, les sorts et les effets du registre du <a class=\"pagelink\" href=\"Pathfinder-RPG.registre.ashx\" title=\"Registre\">son</a> ou basés sur le langage.<br/><br/>",
  "mythique": {
    "description": "Ce sort s’applique également à la télépathie et coupe net toute tentative de communication mentale à l’intérieur de la zone d’effet. Au moment de l’incantation, le personnage peut décider de s’immuniser à son propre effet de silence mythique et peut désigner jusqu’à une créature par grade qui bénéficiera également de cette immunité. Les créatures immunisées au silence mythique peuvent ainsi être normalement affectées par des effets de son.",
    "description_html": "Ce sort s’applique également à la télépathie et coupe net toute tentative de communication mentale à l’intérieur de la zone d’effet. Au moment de l’incantation, le personnage peut décider de s’immuniser à son propre effet de silence mythique et peut désigner jusqu’à une créature par grade qui bénéficiera également de cette immunité. Les créatures immunisées au silence mythique peuvent ainsi être normalement affectées par des effets de son."
  },
  "variantes": [],
  "sources": [
    "Mythic Adventures, Mythic Origins/Campagnes mythiques"
  ],
  "autres": {},
  "classes": [
    {
      "classe": "Antipaladin",
      "slug": "antipaladin",
      "niveau": 2,
      "niveau_page": 2,
      "concordance": true
    },
    {
      "classe": "Barde",
      "slug": "barde",
      "niveau": 2,
      "niveau_page": 2,
      "concordance": true
    },
    {
      "classe": "Hypnotiseur",
      "slug": "hypnotiseur",
      "niveau": 2,
      "niveau_page": 2,
      "concordance": true
    },
    {
      "classe": "Inquisiteur",
      "slug": "inquisiteur",
      "niveau": 2,
      "niveau_page": 2,
      "concordance": true
    },
    {
      "classe": "Prêtre/Prêtre combattant/Oracle",
      "slug": "pretre-pretre-combattant-oracle",
      "niveau": 2,
      "niveau_page": 2,
      "concordance": true
    },
    {
      "classe": "Psychiste",
      "slug": "psychiste",
      "niveau": 2,
      "niveau_page": 2,
      "concordance": true
    }
  ],
  "meta": {
    "url": "https://www.pathfinder-fr.org/Wiki/Pathfinder-RPG.Silence.ashx",
    "cache_fichier": "cache/html/b2351fe7435865db6fd2ae658d16151bf8760b01.html",
    "recupere_le": "2026-07-29T07:40:31.501272+00:00",
    "parser_version": "1.0.0"
  }
}
