{
  "id": "poursuite-divine",
  "nom": "Poursuite divine",
  "url": "https://www.pathfinder-fr.org/Wiki/Pathfinder-RPG.Poursuite%20divine.ashx",
  "ecole": "Transmutation",
  "descripteurs": [],
  "niveaux": {
    "Inq": 5
  },
  "temps_incantation": "1 action simple",
  "composantes": "V, G",
  "portee": "personnelle",
  "cible": "lanceur de sorts",
  "duree": "1 minute/niveau, voir texte",
  "jet_de_sauvegarde": null,
  "resistance_magie": null,
  "description": "Le personnage choisit une créature qu’il a blessée et qui se trouve dans les 18 mètres. Si elle a une vitesse de creusement, d’escalade, de nage ou de vol, il en bénéficie pendant la durée du sort, à la même vitesse et avec la même manœuvrabilité que la créature choisie. Si le personnage acquiert ainsi une vitesse de creusement ou de nage, il peut respirer sous terre ou sous l’eau. Si la créature s’éloigne de plus de 300 mètres du personnage, le sort se termine. Si celle-ci possède plusieurs types de mouvement, le personnage en choisit un.",
  "description_html": "<br/><br/>Le personnage choisit une créature qu’il a blessée et qui se trouve dans les 18 mètres. Si elle a une vitesse de creusement, d’escalade, de nage ou de vol, il en bénéficie pendant la durée du sort, à la même vitesse et avec la même manœuvrabilité que la créature choisie. Si le personnage acquiert ainsi une vitesse de creusement ou de nage, il peut respirer sous terre ou sous l’eau. Si la créature s’éloigne de plus de 300 mètres du personnage, le sort se termine. Si celle-ci possède plusieurs types de mouvement, le personnage en choisit un.<br/><br/>",
  "mythique": {
    "description": "La vitesse de déplacement du type conféré par le sort s’élève à 9 mètres. Cet ajustement est considéré comme un bonus d’altération. Le personnage gagne un bonus aux tests de Perception et de Survie effectués envers la créature sélectionnée. C’est un bonus de sainteté si le personnage est Bon et un bonus de malfaisance si le personnage est Mauvais ; s’il est Neutre, choisissez l’un ou l’autre.",
    "description_html": "La vitesse de déplacement du type conféré par le sort s’élève à 9 mètres. Cet ajustement est considéré comme un bonus d’altération. Le personnage gagne un bonus aux tests de <a class=\"pagelink\" href=\"Pathfinder-RPG.Perception.ashx\" title=\"Perception\">Perception</a> et de <a class=\"pagelink\" href=\"Pathfinder-RPG.Survie.ashx\" title=\"Survie\">Survie</a> effectués envers la créature sélectionnée. C’est un bonus de sainteté si le personnage est Bon et un bonus de malfaisance si le personnage est Mauvais ; s’il est Neutre, choisissez l’un ou l’autre."
  },
  "variantes": [],
  "sources": [
    "Ultimate Magic/Art de la Magie",
    "Mythic Adventures, Mythic Origins/Campagnes mythiques"
  ],
  "autres": {},
  "classes": [],
  "meta": {
    "url": "https://www.pathfinder-fr.org/Wiki/Pathfinder-RPG.Poursuite%20divine.ashx",
    "cache_fichier": "cache/html/7ac3d39d526097bf5ab347d5bbbcd621f8123e67.html",
    "recupere_le": "2026-07-28T23:04:28.036130+00:00",
    "parser_version": "1.0.0"
  }
}
