{
  "id": "broyage-psychique-iv",
  "nom": "Broyage psychique IV",
  "url": "https://www.pathfinder-fr.org/Wiki/Pathfinder-RPG.Broyage%20psychique%20IV.ashx",
  "ecole": "Nécromancie",
  "descripteurs": [
    "effet mental"
  ],
  "niveaux": {
    "Psy": 8
  },
  "temps_incantation": "1 action simple",
  "composantes": "G",
  "portee": "courte (7,50 m + 1,50 m/2 niveaux)",
  "cible": "1 créature",
  "duree": "instantanée",
  "jet_de_sauvegarde": "Volonté, partiel et Vigueur, partiel (voir texte)",
  "resistance_magie": "oui",
  "description": "Ce sort fonctionne comme broyage psychique I mais la cible subit 9d6 points de dégâts +1 par niveau de lanceur de sorts si elle réussit son jet de Volonté ou de Vigueur. Elle ne reçoit aucun bonus lié à ses points de vie. S’il lui reste moins de la moitié de ses points de vie, elle n’a pas droit au moindre jet de Vigueur pour résister au sort et agit comme si elle avait raté ce jet. On peut lancer ce sort dans une version réduite.",
  "description_html": "<hr/>\nCe sort fonctionne comme <i><a class=\"pagelink\" href=\"Pathfinder-RPG.broyage%20psychique%20I.ashx\" title=\"Broyage psychique I\">broyage psychique I</a></i> mais la cible subit 9d6 points de dégâts +1 par niveau de lanceur de sorts si elle réussit son jet de <a class=\"pagelink\" href=\"Pathfinder-RPG.Volont%c3%a9.ashx\" title=\"Volonté\">Volonté</a> ou de <a class=\"pagelink\" href=\"Pathfinder-RPG.Vigueur.ashx\" title=\"Vigueur\">Vigueur</a>. Elle ne reçoit aucun bonus lié à ses points de vie. S’il lui reste moins de la moitié de ses points de vie, elle n’a pas droit au moindre jet de <a class=\"pagelink\" href=\"Pathfinder-RPG.Vigueur.ashx\" title=\"Vigueur\">Vigueur</a> pour résister au sort et agit comme si elle avait raté ce jet. On peut lancer ce sort dans une version réduite.<br/><br/><br/><br/>",
  "mythique": null,
  "variantes": [],
  "sources": [
    "Occult Adventures/Aventures occultes"
  ],
  "autres": {
    "sorts_lies": "Broyage psychique I"
  },
  "classes": [],
  "meta": {
    "url": "https://www.pathfinder-fr.org/Wiki/Pathfinder-RPG.Broyage%20psychique%20IV.ashx",
    "cache_fichier": "cache/html/646404c24b0aaa463ab73e37d728145ac6804660.html",
    "recupere_le": "2026-07-28T22:45:04.066157+00:00",
    "parser_version": "1.0.0"
  }
}
