{
  "id": "voile-nain",
  "nom": "Voile nain",
  "url": "https://www.pathfinder-fr.org/Wiki/Pathfinder-RPG.Voile%20nain.ashx",
  "ecole": "Transmutation",
  "descripteurs": [],
  "niveaux": {
    "Pal": 2,
    "Prê": 2
  },
  "temps_incantation": "1 action simple",
  "composantes": "V, G",
  "portee": "courte (7,50 m + 1,50 m/2 niveaux) (5 c + 1 c/2 niveaux)",
  "cible": "une créature",
  "duree": "10 minutes/niveau",
  "jet_de_sauvegarde": "Volonté, annule (inoffensif)",
  "resistance_magie": "oui (inoffensif)",
  "description": "Ce sort est réservé aux personnages qui vénèrent la déesse naine de l'amour.\nCe sort améliore, chez la cible, les qualités que les nains apprécient. Il la rend plus attirante, plus présentable et digne du respect et de l’admiration des nains. La cible garde son apparence et peut être normalement reconnue. Elle gagne un bonus de circonstances de +2 aux tests effectués pour influencer des nains (en utilisant la Diplomatie ou l’Intimidation, par exemple).",
  "description_html": "<br/><br/><i>Ce sort est réservé aux personnages qui vénèrent la déesse naine de l'amour.</i><br/><br/>Ce sort améliore, chez la cible, les qualités que les nains apprécient. Il la rend plus attirante, plus présentable et digne du respect et de l’admiration des nains. La cible garde son apparence et peut être normalement reconnue. Elle gagne un bonus de circonstances de +2 aux tests effectués pour influencer des nains (en utilisant la <a class=\"pagelink\" href=\"Pathfinder-RPG.Diplomatie.ashx\" title=\"Diplomatie\">Diplomatie</a> ou l’<a class=\"pagelink\" href=\"Pathfinder-RPG.Intimidation.ashx\" title=\"Intimidation\">Intimidation</a>, par exemple).",
  "mythique": null,
  "variantes": [],
  "sources": [
    "Advanced Race Guide, Elves of Golarion, Gnomes of Golarion, Goblins of Golarion, Halflings of Golarion, Humans of Golarion, Dwarves of Golarion, Orcs of Golarion/Manuel des races"
  ],
  "autres": {
    "restriction_divinite": "Option plus\ncommune chez\nles nains."
  },
  "classes": [
    {
      "classe": "Paladin",
      "slug": "paladin",
      "niveau": 2,
      "niveau_page": 2,
      "concordance": true
    },
    {
      "classe": "Prêtre/Prêtre combattant/Oracle",
      "slug": "pretre-pretre-combattant-oracle",
      "niveau": 2,
      "niveau_page": 2,
      "concordance": true
    }
  ],
  "meta": {
    "url": "https://www.pathfinder-fr.org/Wiki/Pathfinder-RPG.Voile%20nain.ashx",
    "cache_fichier": "cache/html/09301ca2fd7579420a3f61c6b9556c269a1e0ab0.html",
    "recupere_le": "2026-07-29T07:44:32.364219+00:00",
    "parser_version": "1.0.0"
  }
}
