{
  "id": "manteau-marin",
  "nom": "Manteau marin",
  "url": "https://www.pathfinder-fr.org/Wiki/Pathfinder-RPG.Manteau%20marin.ashx",
  "ecole": "Invocation (création)",
  "descripteurs": [
    "eau"
  ],
  "niveaux": {
    "Dru": 8,
    "Ens/Mag": 8
  },
  "temps_incantation": "1 action simple",
  "composantes": "V, G, M (un verre d'eau)",
  "portee": "personnelle",
  "cible": "lanceur de sorts",
  "duree": "1 minute/niveau",
  "jet_de_sauvegarde": null,
  "resistance_magie": null,
  "description": "Le personnage s'enveloppe d'une colonne tournoyante d'eau élémentaire à l'état pur qui occupe sa case et s'élève à 9 mètres (6 c). Il gagne une vitesse de nage égale à sa vitesse de déplacement de base et il est capable de voir, d'entendre et de respirer librement dans le manteau marin. En revanche, les attaques portées contre lui sont considérées comme ayant lieu sous l'eau. Le personnage bénéficie d'un abri amélioré (bonus d'abri de +8 à la CA, +4 aux jets de Réflexes) contre les adversaires qui ne disposent pas de la liberté de mouvement. L'abri apporté par le manteau marin ne permet pas au personnage de faire de test de Discrétion et n'empêche pas les attaques d'opportunité. Les attaques magiques lancées contre lui ne sont pas affectées, à moins qu'elles ne nécessitent un jet d'attaque ou qu'elles ne fonctionnent pas sous l'eau (comme le nuage nauséabond).\nLe manteau marin bloque la ligne d'effet de tout sort ou effet surnaturel de feu mais les ennemis peuvent essayer d'utiliser des sorts de feu au sein du manteau marin, ce qui exige un test de niveau de lanceur de sorts (DD 20 + niveau du sort) et, si le sort réussit, il prend la forme d'une bulle de vapeur dans le manteau au lieu de revêtir son apparence ordinaire.\nLe manteau marin permet au personnage de faire une attaque de coup à l'aide d'un pseudopode aqueux, ce qui inflige des dégâts appropriés à la taille du personnage. Cette attaque a une allonge de 9 mètres (6 c). De plus, par une action simple, le personnage peut tenter d'éteindre un feu d'un simple contact. Il noie automatiquement tout feu ordinaire sur un cube de 3 mètres (2 c) de côté. Son contact agit comme une dissipation de la magie contre les flammes d'origine magique et contre tout effet de feu non instantané qui entre en contact avec lui (comme lame de feu, sphère de feu et nuage incendiaire). Même si le personnage ne parvient pas à éteindre le feu, ce dernier ne le blesse pas. Une arme de feu ou de feu intense qui frappe le personnage voit son pouvoir disparaître pendant 1d4 rounds si son propriétaire rate un jet de Vigueur.",
  "description_html": "<br/><br/>Le personnage s'enveloppe d'une colonne tournoyante d'eau élémentaire à l'état pur qui occupe sa case et s'élève à 9 mètres (6 <abbr title=\"cases\">c</abbr>). Il gagne une vitesse de nage égale à sa vitesse de déplacement de base et il est capable de voir, d'entendre et de respirer librement dans le <i>manteau marin</i>. En revanche, les attaques portées contre lui sont considérées comme ayant lieu <a class=\"pagelink\" href=\"Pathfinder-RPG.Milieu%20aquatique.ashx#COMBATSOUSEAU\" title=\"Le milieu aquatique\">sous l'eau</a>. Le personnage bénéficie d'un abri amélioré (bonus d'abri de +8 à la <a class=\"pagelink\" href=\"Pathfinder-RPG.CA.ashx\" title=\"CA\">CA</a>, +4 aux jets de <a class=\"pagelink\" href=\"Pathfinder-RPG.R%c3%a9flexes.ashx\" title=\"Réflexes\">Réflexes</a>) contre les adversaires qui ne disposent pas de la <i><a class=\"pagelink\" href=\"Pathfinder-RPG.libert%c3%a9%20de%20mouvement.ashx\" title=\"Liberté de mouvement\">liberté de mouvement</a></i>. L'abri apporté par le <i>manteau marin</i> ne permet pas au personnage de faire de test de <a class=\"pagelink\" href=\"Pathfinder-RPG.Discr%c3%a9tion.ashx\" title=\"Discrétion\">Discrétion</a> et n'empêche pas les <a class=\"pagelink\" href=\"Pathfinder-RPG.attaque%20dopportunit%c3%a9.ashx\" title=\"attaque d'opportunité\">attaques d'opportunité</a>. Les attaques magiques lancées contre lui ne sont pas affectées, à moins qu'elles ne nécessitent un jet d'attaque ou qu'elles ne fonctionnent pas sous l'eau (comme le <i><a class=\"pagelink\" href=\"Pathfinder-RPG.nuage%20naus%c3%a9abond.ashx\" title=\"Nuage nauséabond\">nuage nauséabond</a></i>).<br/><br/>Le <i>manteau marin</i> bloque la ligne d'effet de tout sort ou effet surnaturel de <a class=\"pagelink\" href=\"Pathfinder-RPG.registre.ashx\" title=\"Registre\">feu</a> mais les ennemis peuvent essayer d'utiliser des sorts de <a class=\"pagelink\" href=\"Pathfinder-RPG.registre.ashx\" title=\"Registre\">feu</a> au sein du <i>manteau marin</i>, ce qui exige un test de niveau de lanceur de sorts (DD 20 + <a class=\"pagelink\" href=\"Pathfinder-RPG.niveau%20du%20sort.ashx\" title=\"niveau du sort\">niveau du sort</a>) et, si le sort réussit, il prend la forme d'une bulle de vapeur dans le manteau au lieu de revêtir son apparence ordinaire.<br/><br/>Le <i>manteau marin </i>permet au personnage de faire une attaque de coup à l'aide d'un pseudopode aqueux, ce qui inflige des dégâts appropriés à la taille du personnage. Cette attaque a une allonge de 9 mètres (6 <abbr title=\"cases\">c</abbr>). De plus, par une <a class=\"pagelink\" href=\"Pathfinder-RPG.action%20simple.ashx\" title=\"Action simple\">action simple</a>, le personnage peut tenter d'éteindre un feu d'un simple contact. Il noie automatiquement tout feu ordinaire sur un cube de 3 mètres (2 <abbr title=\"cases\">c</abbr>) de côté. Son contact agit comme une <i><a class=\"pagelink\" href=\"Pathfinder-RPG.dissipation%20de%20la%20magie.ashx\" title=\"Dissipation de la magie\">dissipation de la magie</a></i> contre les flammes d'origine magique et contre tout effet de feu non instantané qui entre en contact avec lui (comme <i><a class=\"pagelink\" href=\"Pathfinder-RPG.lame%20de%20feu.ashx\" title=\"Lame de feu\">lame de feu</a></i>, <i><a class=\"pagelink\" href=\"Pathfinder-RPG.sph%c3%a8re%20de%20feu.ashx\" title=\"Sphère de feu\">sphère de feu</a></i> et <i><a class=\"pagelink\" href=\"Pathfinder-RPG.nuage%20incendiaire.ashx\" title=\"Nuage incendiaire\">nuage incendiaire</a></i>). Même si le personnage ne parvient pas à éteindre le feu, ce dernier ne le blesse pas. Une arme <i><a class=\"pagelink\" href=\"Pathfinder-RPG.feu%20(propri%c3%a9t%c3%a9).ashx\" title=\"feu (propriété)\">de feu</a></i> ou <i><a class=\"pagelink\" href=\"Pathfinder-RPG.feu%20intense%20(propri%c3%a9t%c3%a9).ashx\" title=\"feu intense (propriété)\">de feu intense</a></i> qui frappe le personnage voit son pouvoir disparaître pendant 1d4 <a class=\"pagelink\" href=\"Pathfinder-RPG.round.ashx\" title=\"round\">rounds</a> si son propriétaire rate un jet de <a class=\"pagelink\" href=\"Pathfinder-RPG.Vigueur.ashx\" title=\"Vigueur\">Vigueur</a>.",
  "mythique": null,
  "variantes": [],
  "sources": [
    "Advanced Player's Guide/Manuel des joueurs - Règles avancées"
  ],
  "autres": {},
  "classes": [],
  "meta": {
    "url": "https://www.pathfinder-fr.org/Wiki/Pathfinder-RPG.Manteau%20marin.ashx",
    "cache_fichier": "cache/html/5546c7d3afb37bce208de8e91f71006d053b8d88.html",
    "recupere_le": "2026-07-28T23:00:07.739456+00:00",
    "parser_version": "1.0.0"
  }
}
