{
  "id": "oeuf-empoisonne",
  "nom": "Œuf empoisonné",
  "url": "https://www.pathfinder-fr.org/Wiki/Pathfinder-RPG.%c5%92uf%20empoisonn%c3%a9.ashx",
  "ecole": "Transmutation",
  "descripteurs": [
    "poison"
  ],
  "niveaux": {
    "Bard": 1,
    "Cham": 1,
    "Ens/Mag": 1,
    "Inq": 1,
    "Magus": 1,
    "Prê": 1,
    "Sor": 1
  },
  "temps_incantation": "1 action simple",
  "composantes": "V, G, FD",
  "portee": "contact",
  "cible": "1 œuf",
  "duree": "1 minute/niveau",
  "jet_de_sauvegarde": "non (objet)",
  "resistance_magie": "non (objet)",
  "description": "Le personnage transforme le contenu d’un œuf normal en une dose de venin de petit mille-pattes (Blessure; JdS DD 11, fréquence 1/round pendant 4 rounds, effet 1 Dex, guérison 1 réussite). Le poison redevient un œuf normal à la fin de la durée du sort (le contenu de l’œuf revenu à son état normal est inoffensif, à moins que la créature empoisonnée ne soit vulnérable aux œufs). Cuit ou cru, l’œuf doit être entier et dans sa coquille lorsque le sort est lancé. Lorsqu'on applique le contenu de l'oeuf empoisonné sur une arme, il n'y a aucun risque de s'y exposer, comme avec la capacité de classe utilisation du poison.",
  "description_html": "<br/><br/>Le personnage transforme le contenu d’un œuf normal en une dose de <a class=\"pagelink\" href=\"Pathfinder-RPG.Poisons.ashx#Venindemille-pattesdetailleP\" title=\"Les poisons  \">venin de petit mille-pattes</a> (Blessure; <i>JdS</i> <a class=\"pagelink\" href=\"Pathfinder-RPG.DD.ashx\" title=\"DD\">DD</a> 11, <i>fréquence</i> 1/round pendant 4 rounds, <i>effet</i> 1 <a class=\"pagelink\" href=\"Pathfinder-RPG.Dex.ashx\" title=\"Dex\">Dex</a>, <i>guérison</i> 1 réussite). Le poison redevient un œuf normal à la fin de la durée du sort (le contenu de l’œuf revenu à son état normal est inoffensif, à moins que la créature empoisonnée ne soit vulnérable aux œufs). Cuit ou cru, l’œuf doit être entier et dans sa coquille lorsque le sort est lancé. Lorsqu'on applique le contenu de l'oeuf empoisonné sur une arme, il n'y a aucun risque de s'y exposer, comme avec la capacité de classe <a class=\"pagelink\" href=\"Pathfinder-RPG.Alchimiste.ashx#UTILISATIONDUPOISON\" title=\"L'alchimiste\">utilisation du poison</a>.",
  "mythique": null,
  "variantes": [],
  "sources": [
    "Inner Sea Gods/Dieux de la mer Intérieure",
    "Gods and Magic, Faiths of Purity, Faiths of Balance, Faiths of Corruption/Dieux et magie"
  ],
  "autres": {
    "restriction_divinite": "Option plus\ncommune chez\nles fidèles\nde Norgorber."
  },
  "classes": [],
  "meta": {
    "url": "https://www.pathfinder-fr.org/Wiki/Pathfinder-RPG.%c5%92uf%20empoisonn%c3%a9.ashx",
    "cache_fichier": "cache/html/45b656059e7a14cebc6c74be1e3943673a9ac060.html",
    "recupere_le": "2026-07-28T22:39:45.349843+00:00",
    "parser_version": "1.0.0"
  }
}
