{
  "id": "limite-infranchissable",
  "nom": "Limite infranchissable",
  "url": "https://www.pathfinder-fr.org/Wiki/Pathfinder-RPG.Limite%20infranchissable.ashx",
  "ecole": "Abjuration",
  "descripteurs": [],
  "niveaux": {
    "Ens/Mag": 1,
    "Magus": 1,
    "San": 1
  },
  "temps_incantation": "1 action simple",
  "composantes": "V, G",
  "portee": "1,5 m",
  "cible": "rayonnement de 1,5 m centrée sur le lanceur",
  "duree": "1 round/niveau",
  "jet_de_sauvegarde": "aucun",
  "resistance_magie": "non",
  "description": "Le personnage crée une ligne écarlate brillante autour de la zone. Contre les créatures situées dans la zone, le personnage peut tenter un nombre d’attaques d’opportunité supplémentaires par round égal au modificateur de sa caractéristique de lancement de sorts (Intelligence pour les magi et les magiciens, Charisme pour les sanguins et les ensorceleurs), même si cela ne lui permet pas de faire plus d’une attaque contre une créature par action provoquant une attaque d’opportunité.",
  "description_html": "<br/><br/>Le personnage crée une ligne écarlate brillante autour de la zone. Contre les créatures situées dans la zone, le personnage peut tenter un nombre d’attaques d’opportunité supplémentaires par round égal au modificateur de sa caractéristique de lancement de sorts (<a class=\"pagelink\" href=\"Pathfinder-RPG.Intelligence.ashx\" title=\"L'Intelligence\">Intelligence</a> pour les <a class=\"pagelink\" href=\"Pathfinder-RPG.magus.ashx\" title=\"Le magus\">magi</a> et les <a class=\"pagelink\" href=\"Pathfinder-RPG.magicien.ashx\" title=\"Le magicien\">magiciens</a>, <a class=\"pagelink\" href=\"Pathfinder-RPG.Charisme.ashx\" title=\"Le Charisme\">Charisme</a> pour les <a class=\"pagelink\" href=\"Pathfinder-RPG.sanguin.ashx\" title=\"Le sanguin\">sanguins</a> et les <a class=\"pagelink\" href=\"Pathfinder-RPG.ensorceleur.ashx\" title=\"L'ensorceleur\">ensorceleurs</a>), même si cela ne lui permet pas de faire plus d’une attaque contre une créature par action provoquant une <a class=\"pagelink\" href=\"Pathfinder-RPG.AO.ashx\" title=\"Attaque d'opportunité (redirection)\">attaque d’opportunité</a>.",
  "mythique": null,
  "variantes": [],
  "sources": [
    "Advanced Class Guide/Manuel des joueurs - Classes avancées"
  ],
  "autres": {},
  "classes": [
    {
      "classe": "Arcaniste/Ensorceleur/Magicien",
      "slug": "arcaniste-ensorceleur-magicien",
      "niveau": 1,
      "niveau_page": 1,
      "concordance": true
    },
    {
      "classe": "Magus",
      "slug": "magus",
      "niveau": 1,
      "niveau_page": 1,
      "concordance": true
    },
    {
      "classe": "Sanguin",
      "slug": "sanguin",
      "niveau": 1,
      "niveau_page": 1,
      "concordance": true
    }
  ],
  "meta": {
    "url": "https://www.pathfinder-fr.org/Wiki/Pathfinder-RPG.Limite%20infranchissable.ashx",
    "cache_fichier": "cache/html/57611a2d5a62c47ce4ccacca71d41e96604806d7.html",
    "recupere_le": "2026-07-28T22:58:42.663151+00:00",
    "parser_version": "1.0.0"
  }
}
