{
  "id": "resistance-a-l-age-mineure",
  "nom": "Résistance à l'âge mineure",
  "url": "https://www.pathfinder-fr.org/Wiki/Pathfinder-RPG.R%c3%a9sistance%20%c3%a0%20l%c3%a2ge%20mineure.ashx",
  "ecole": "Transmutation",
  "descripteurs": [],
  "niveaux": {
    "Alch": 3,
    "Dru": 4,
    "Ens/Mag": 4,
    "Occ": 3,
    "Psy": 4,
    "Sor": 4
  },
  "temps_incantation": "1 action simple",
  "composantes": "V, G",
  "portee": "personnelle",
  "cible": "lanceur de sorts",
  "duree": "24 heures",
  "jet_de_sauvegarde": null,
  "resistance_magie": null,
  "description": "Le personnage ignore les inconvénients liés à son âge moyen.\nIl n’a pas l’air plus jeune et le sort ne l’empêche pas de mourir de vieillesse mais, tant qu’il fait effet, il ignore les malus de -1 à la force, la dextérité et la constitution qui apparaissent avec l’âge moyen.\nEn revanche il conserve les bonus d’intelligence, de sagesse et de charisme liés, tant que le sort fait effet. Les malus supplémentaires qui viennent avec l’âge avancé et vénérable s’appliquent en totalité.",
  "description_html": "<br/><br/><br/>Le personnage ignore les inconvénients liés à son <a class=\"pagelink\" href=\"Pathfinder-RPG.%c3%a9tat%20civil%20et%20mensurations.ashx#AGE\" title=\"État civil et mensurations\">âge moyen</a>. <br/><br/>Il n’a pas l’air plus jeune et le sort ne l’empêche pas de mourir de vieillesse mais, tant qu’il fait effet, il ignore les malus de -1 à la <a class=\"pagelink\" href=\"Pathfinder-RPG.force.ashx\" title=\"La Force\">force</a>, la <a class=\"pagelink\" href=\"Pathfinder-RPG.dext%c3%a9rit%c3%a9.ashx\" title=\"La Dextérité\">dextérité</a> et la <a class=\"pagelink\" href=\"Pathfinder-RPG.constitution.ashx\" title=\"La Constitution\">constitution</a> qui apparaissent avec l’âge moyen. <br/><br/>En revanche il conserve les bonus d’<a class=\"pagelink\" href=\"Pathfinder-RPG.intelligence.ashx\" title=\"L'Intelligence\">intelligence</a>, de <a class=\"pagelink\" href=\"Pathfinder-RPG.sagesse.ashx\" title=\"La Sagesse\">sagesse</a> et de <a class=\"pagelink\" href=\"Pathfinder-RPG.charisme.ashx\" title=\"Le Charisme\">charisme</a> liés, tant que le sort fait effet. Les malus supplémentaires qui viennent avec l’âge avancé et vénérable s’appliquent en totalité.",
  "mythique": null,
  "variantes": [],
  "sources": [
    "Ultimate Magic/Art de la Magie"
  ],
  "autres": {},
  "classes": [],
  "meta": {
    "url": "https://www.pathfinder-fr.org/Wiki/Pathfinder-RPG.R%c3%a9sistance%20%c3%a0%20l%c3%a2ge%20mineure.ashx",
    "cache_fichier": "cache/html/0fa0cc24cfddbf971e739f7642f92dd3c38790d0.html",
    "recupere_le": "2026-07-29T07:36:05.375031+00:00",
    "parser_version": "1.0.0"
  }
}
